What are the ideal soil conditions for specific fruit crops?,Medium textured silt loam or fine sandy loam makes good orchard soil. Most fruit plants like slightly acidic to neutral soil reaction (pH 6-7). Some fruit species can some times tolerate little more acidic or alkaline medium but too acidic or too alkaline soil should be avoided.
What is the best location on my property to plant fruit trees?,"Most fruit bearing trees and shrubs will benefit from as much light as they can get, especially in temperate climates. Without sufficient sunlight, they may not set fruit. Or their fruit may not ripen well. On a small lot, the best place to consider is at the south of your home (northern hemisphere)."
How to prepare soil for planting trees?,Steps to follow to prepare your soil for growing fruits include: 1.Clearing large rocks and weeds. 2.Testing the soil. 3.Adjusting the soil. 4.Tilling the soil. 5.Hilling up the surface soil. 6.Add Mulch
How should banana plants be spaced?,"Bananas can be planted with higher density at 1.5m x 1.5 m but yields are poor due to competition for sunlight. The recommended spacing is at 2.0m x 2.5m with 2,000 plants per hectare since that is the standard distance to minimize Sigatoka."
How can we prevent witches broom in cocoa plant?,Good sanitation is the most effective method of controlling the disease; material known to be infected should be removed and destroyed; removal of infected material can be difficult as there may be no visible symptoms; new fungicides and resistant cocoa varieties are being developed to help control the disease.
What is witches broom in cocoa plant?,Characteristic proliferation of shoots and brooms from bud; production of branches which do not produce fruit; distorted pods with green patches which give an appearance of uneven ripening.
How can we prevent frosty pod in cocoa plant?,Planting cocoa varieties that produce pods during the dry season allows the pod to avoid the disease; pods showing symptoms of disease should be removed to prevent spread; application of copper containing fungicides will help reduce disease incidence.
What is frosty pod in cocoa plant?,Spots on surface of immature pods; spots turning brown and rapidly enlarging to cover entire pod surface; disease affects only actively growing pods.
How can we prevent Cocoa swollen shoot in cocoa plant?,Infected trees and those surrounding them should be removed and destroyed (up to 5 m from infected tree if less than 10 trees are infected and up to a distance of 15 m if greater than 100 trees are infected) to prevent further spread; a gap should be placed between cocoa plantations of at least 10 m (33 ft) and it may be possible to isolate cocoa plantations using a non-host crop such as oil palm growing between plantations.
What is Cocoa swollen shoot in cocoa plant?,"Swelling of leaves and shoots; red leaf veins, notably in young leaves; chlorotic patches next to leaf veins; chlorotic spots or flecks on leaves mottled, smooth pods with reduced beans; mottled coloration on pods; stems may develop swellings at nodes or internodes and shoot tips; progressive defoliation may occur ultimately leading to the death of the tree."
How can we prevent black pod in cocoa plant?,Protective sprays of copper containing fungicides in combination with systemic fungicides are often recommended to control the disease; cocoa plants should be well spaced to allow good air circulation through the plantation; mummified pods should be removed and destroyed to reduce spread
What is black pod in cocoa plant?,"Translucent spots on pod surface which develop into a small, dark hard spots; entire pod becomes black and necrotic with 14 days of initial symptoms; white to yellow downy growth on black areas; internal tissues become dry and shriveled resulting in mummified pods"